SyncScriptBuilder	ScriptBuilder	
TaskScheduler	Instance	Collection of settings for the _Task Scheduler_ feature.
Team	Instance	The `Class.Team` class represents a faction in a Roblox place. The only valid parent for a Team is in the `Class.Teams` service.
TeamCreateData	Instance	
TeamCreateService	Instance	
Teams	Instance	The Teams service holds a game's `Class.Team` objects. `Class.Team` objects must be parented to the Teams service.
TeleportAsyncResult	Instance	The return structure of the `TeleportAsync` function call.
TeleportOptions	Instance	Optional input arguments to the `Class.TeleportService:TeleportAsync()` function.
TeleportService	Instance	Enables transporting `Class.Player|Players` between places and servers. For more information on how to teleport players between servers, see [Teleport between places](../../../projects/teleport.md).
Terrain	BasePart	`Terrain` lets you to create dynamically morphable environments.
TerrainDetail	Instance	Determines appearance of a certain terrain face direction.
TerrainRegion	Instance	
TestService	Instance	A service used by Roblox to run controlled tests of the engine. It is available for developers to use, to a limited degree.
TextBox	GuiObject	A 2D user interface element that displays player-editable text.
TextBoxService	Instance	
TextButton	GuiButton	A 2D user interface element that displays interactive text.
TextChannel	Instance	Represents a text chat channel.
TextChatCommand	Instance	Represents a text chat command.
TextChatConfigurations	Instance	The parental class of all text chat configurations.
TextChatMessage	Instance	A data object representing a text chat message.
TextChatMessageProperties	Instance	Overrides `Class.TextChatMessage` properties when returned by callbacks defined in `Class.TextChatService.OnIncomingMessage` or `Class.TextChannel.OnIncomingMessage`.
TextChatService	Instance	A service handling in-experience text chat.
TextFilterResult	Instance	
TextFilterTranslatedResult	Instance	
TextGenerator	Instance	Gives access to a large language model for text generation.
TextLabel	GuiLabel	A 2D user interface element that displays non-interactive text.
TextService	Instance	Service internally responsible for handling the display of text.
TextSource	Instance	Represents a speaker in a `Class.TextChannel`.
Texture	Decal	Applies a repeating image texture to the face of a parent `Class.BasePart`.
TimerService	Instance	An internal service responsible for scheduling timed events. It is used by the `Class.Debris` class. Its functionality can not be accessed by developers.
Tool	BackpackItem	An object, such as a weapon, that can be equipped by a `Class.Humanoid`.
Torque	Constraint	Applies constant torque to an assembly from its center of mass.
TorsionSpringConstraint	Constraint	A rotational spring that opposes the angular motion between two axes.
TotalCountTimeIntervalItem	StatsItem	Measures a total-count-over-time interval.
TouchInputService	Instance	An internal service responsible for touch inputs on mobile devices.
TouchTransmitter	Instance	An internal object used by networking and replication code to transmit `Class.BasePart.Touched` and `Class.BasePart.TouchEnded` events.
Trail	Instance	Used to create a trail effect between two attachments.
Translator	Instance	The role of a Translator is to manufacture/return strings localized for the viewing player.
TremoloSoundEffect	SoundEffect	Creates a trembling effect on a sound by varying the volume of the sound up and down.
TriangleMeshPart	BasePart	Abstract intermediate class that manages physical geometry properties for PartOperations and MeshParts.
TrussPart	BasePart	Similar to a `Class.Part` but with a different visual `Class.TrussPart.Style|Style` and the important distinction that default characters are able to climb it.
Tween	TweenBase	The `Class.Tween` object controls the playback of an interpolation.
TweenBase	Instance	Abstract base class for in-between interpolation handlers. `Class.Tween` inherits from `Class.TweenBase`.
TweenService	Instance	Used to create `Class.Tween|Tweens` which interpolate, or tween, the properties of instances.
UGCValidationService	Instance	
UIAspectRatioConstraint	UIConstraint	Ensures the parent UI element maintains a particular aspect ratio.
UIBase	Instance	`Class.UIBase` is the base class for UI layout and constraint classes.
UIComponent	UIBase	A base class for UI constraint and layout classes.
UIConstraint	UIComponent	The base class for UI constraint classes.
UICorner	UIComponent	UI modifier which applies deformation to corners of its parent `Class.GuiObject`.
UIDragDetector	UIComponent	Instance which facilitates and encourages interaction with UI elements in an experience.
UIFlexItem	UIComponent	Defines flex behavior for a `Class.GuiObject` within a `Class.UIListLayout`.
UIGradient	UIComponent	Applies a color and transparency gradient to the UI elements rendered by the parent `Class.GuiObject`.
UIGridLayout	UIGridStyleLayout	Positions sibling UI elements by filling rows using the space of the parent UI element.
UIGridStyleLayout	UILayout	The base class for grid style UI layouts.
UILayout	UIComponent	The base class for UI layout classes.
UIListLayout	UIGridStyleLayout	Positions sibling UI elements in rows or columns within the parent UI container.
UIPadding	UIComponent	Applies padding to the borders of the parent `Class.GuiObject`.
UIPageLayout	UIGridStyleLayout	
UIScale	UIComponent	An object that acts as a multiplier for the size of the parent UI element's scale.
UIShadow	UIComponent	Renders a shadow below the parent UI instance.
UISizeConstraint	UIConstraint	Ensures a `Class.GuiObject` does not become larger or smaller than the constraint's maximum size or minimum size.
UIStroke	UIComponent	Applies an outline to text or a UI border.
UITableLayout	UIGridStyleLayout	Lays out sibling UI elements and their child UI elements as rows/columns and cells in a table.
UITextSizeConstraint	UIConstraint	Ensures that the size of text rendered by certain `Class.GuiObject` classes lies within the range described by `Class.UITextSizeConstraint.MaxTextSize|MaxTextSize` and `Class.UITextSizeConstraint.MinTextSize|MinTextSize`.
UnionOperation	PartOperation	Result of parts that have been joined together into a single solid model.
UniqueIdLookupService	Instance	
UniversalConstraint	Constraint	Ensures two axes on two bodies remain perpendicular.
UnreliableRemoteEvent	BaseRemoteEvent	An object which facilitates asynchronous, unordered and unreliable, one-way communication across the client-server boundary. Scripts firing a `Class.UnreliableRemoteEvent` do not yield.
UserGameSettings	Instance	The UserGameSettings is a singleton class found inside of the `Class.UserSettings` singleton. It holds various persistent settings relating to how the user wants to control their camera, and their character.
UserInputService	Instance	`UserInputService` is primarily used to detect the input types available on a user's device, as well as detect input events.
UserService	Instance	A service that handles queries regarding users on the Roblox platform.
UserSettings	GenericSettings	A singleton object that houses basic user settings, which persist across all games on Roblox.
ValueBase	Instance	Base class of all "value instance" objects.
ValueCurve	Instance	A sorted list of time-value pairs that define a curve. Used to animate a any type of value.
Vector3Curve	Instance	Represents a 3D vector curve, grouping three `Class.FloatCurve` instances.
Vector3Value	ValueBase	A container object for a single Vector3 value.
VectorForce	Constraint	Applies constant force to an assembly.
VehicleController	Controller	
VehicleSeat	BasePart	A seat object that can be used to control a vehicle.
VelocityMotor	JointInstance	
VideoCapture	Capture	A child class of `Class.Capture` for videos.
VideoCaptureService	Instance	
VideoDisplay	GuiObject	A GUI object that displays video content from a connected `Class.VideoPlayer`.
VideoFrame	GuiObject	A GUI object that renders a rectangle, like a `Class.Frame` does, with a moving video image.
VideoPlayer	Instance	Used to play video assets.
VideoSampler	Object	An object for sampling frames from video content.
VideoService	Instance	An internal service that offers no functionality to developers.
ViewportFrame	GuiObject	`Class.GuiObject` that renders 3D objects inside its bounds.
VirtualInput	Object	Simulates mouse, keyboard, and pointer input as if it were performed by a real player.
VirtualInputManager	Instance	An internal service that offers no functionality to developers.
VirtualUser	Instance	VirtualUser is a service that allows you to record the inputs of a user, and then play it back to a limited extent.
VisibilityCheckDispatcher	Instance	
Visit	Instance	The Visit service is a backend service used by Roblox. Its functions are not accessible to developers in any form.
VisualizationMode	Instance	
VisualizationModeCategory	Instance	
VisualizationModeService	Instance	
VoiceChatService	Instance	**VoiceChatService** is responsible for voice chat's high-level functionality.
VRService	Instance	Service responsible for handling interactions between Roblox and Virtual Reality (VR).
VRStatusService	Instance	
WebStreamClient	Object	Maintains a streaming connection.
WedgePart	FormFactorPart	A type of `Class.BasePart` that has a wedge shape.
Weld	JointInstance	
WeldConstraint	Instance	Connects two `Class.BasePart|BaseParts` together such that their relative position and orientation remain the same.
Wire	Instance	Connects one or more `Class.Instance|Instances` to form a processing graph of their streams. At the moment, only audio streams are supported, but this may expand in the future.
WireframeHandleAdornment	HandleAdornment	Renders a wireframe adornment consisting of one or more lines onto a `Class.BasePart` (including `Class.Terrain`) or into the `Class.Workspace`.
Workspace	WorldRoot	**Workspace** houses 3D objects which are rendered to the 3D world. Objects not descending from it will not be rendered or physically interact with the world.
WorkspaceAnnotation	Annotation	
WorldModel	WorldRoot	Extends limited physics for its children on to a parent `Class.ViewportFrame`.
WorldRoot	Model	Base class for handling physics simulation and 3D spatial queries.
WrapDeformer	BaseWrap	Allows for the real-time deformation of a `Class.MeshPart`.
WrapLayer	BaseWrap	The WrapLayer object defines a 3D accessory's inner and outer surfaces and other properties related to layering accessories. These surfaces, or the Inner Cage and Outer Cage, are similar to collision boxes, and describe the surfaces of which other 3D accessories can be placed without clipping or breaking.
WrapTarget	BaseWrap	The WrapTarget object defines a target. A target is the 3D body with only an outer surface, or an Outer Cage.
WrapTextureTransfer	Instance	`Class.WrapTextureTransfer` allows a parent `Class.Decal` to be wrapped around its parent `Class.MeshPart` based on the cage of its `Class.WrapTarget`.
